{
  "schemaVersion": "0.2-draft",
  "assertionId": "srac-score-lifecycle-health-monitor-85da2168-draft-001",
  "subject": {
    "name": "score_lifecycle::health_monitor",
    "purl": "pkg:github/eclipse-score/lifecycle@85da2168328d17a3cf53791ebf93534e5ed921fc#score/health_monitor",
    "version": "85da2168328d17a3cf53791ebf93534e5ed921fc",
    "repository": "https://github.com/eclipse-score/lifecycle",
    "componentPath": "score/health_monitor"
  },
  "safetyRelevance": {
    "status": "safety-related",
    "classification": "ASIL-B"
  },
  "rationale": "Pilot transcription of the ASIL_B metadata present in the pinned Health Monitor component, architecture, requirements and FMEA documents. This draft demonstrates transport and SBOM matching behavior; it is not an independent safety assessment or approval.",
  "requirements": [
    {
      "id": "doc__health_monitor_requirements",
      "type": "component-requirements",
      "uri": "https://github.com/eclipse-score/lifecycle/blob/85da2168328d17a3cf53791ebf93534e5ed921fc/score/health_monitor/docs/requirements/index.rst"
    }
  ],
  "evidence": [
    {
      "id": "doc__health_monitor",
      "type": "component-definition",
      "uri": "https://github.com/eclipse-score/lifecycle/blob/85da2168328d17a3cf53791ebf93534e5ed921fc/score/health_monitor/docs/index.rst"
    },
    {
      "id": "doc__health_monitor_architecture",
      "type": "component-architecture",
      "uri": "https://github.com/eclipse-score/lifecycle/blob/85da2168328d17a3cf53791ebf93534e5ed921fc/score/health_monitor/docs/architecture/index.rst"
    },
    {
      "id": "doc__health_monitor_fmea",
      "type": "safety-analysis",
      "uri": "https://github.com/eclipse-score/lifecycle/blob/85da2168328d17a3cf53791ebf93534e5ed921fc/score/health_monitor/docs/safety_analysis/fmea.rst"
    },
    {
      "id": "health_monitor_tests",
      "type": "test-source",
      "uri": "https://github.com/eclipse-score/lifecycle/tree/85da2168328d17a3cf53791ebf93534e5ed921fc/score/health_monitor/src"
    }
  ],
  "assertion": {
    "status": "draft",
    "author": {
      "name": "Devashri Datta",
      "uri": "https://github.com/devashridatta-dotcom"
    },
    "reviewer": null,
    "created": "2026-09-26T00:00:00Z"
  }
}
